{"schema_version":"polar.plugin/v1","id":"dev.luxeron.engine.wear-os","version":"0.1.0","name":"Polar Pyro Wear OS Target","kind":"engine","publisher":"LUXERON","license":"MIT","source":{"repository":"https://github.com/LUXERON/POLAR-PYRO-WEAR-OS-PLUGIN","commit":"466bb43ea58f1f68895bfafd193f809bf913584d","upstream":"FINAL_WEAR_OS_EXPERIENCE_ENGINE_ARCHITECTURE.md"},"transport":{"kind":"native","command":["polar-wear-plan"]},"capabilities":[{"id":"wear.compile_build_plan","effect":"observe","input_schema":{"type":"object","additionalProperties":false,"required":["application","binding","operations","surface_catalog","capability_catalog","target_profile"]},"output_schema":{"type":"object","required":["application_id","target","modules","operations","euclid_obligations","release_gates"]},"required_grants":[],"evidence_classes":["wear.closed_build_plan"],"timeout_ms":30000}],"contributions":[{"slot":"target.compiler","label":"Wear OS","entry":"wear.compile_build_plan"}],"compatibility":{"host_api":">=1.0 <2.0","android_parent":"dev.luxeron.engine.android","release_gate":"euclid+kotlin+wear-surfaces+power+mutation+physical-device+signing"}}
