{"schema_version":"polar.plugin/v1","id":"dev.luxeron.engine.prose-orchestrator","version":"0.1.0","name":"Polar Pyro Prose Orchestrator","kind":"engine","publisher":"LUXERON","license":"MIT","source":{"repository":"https://github.com/LUXERON/POLAR-PYRO-PROSE-ORCHESTRATOR","commit":"19205983d2f953b6459e47bc49955294e24c0527"},"transport":{"kind":"native","command":["python","-m","polar_pyro_prose"]},"capabilities":[{"id":"prose.compile_answer_plan","effect":"observe","input_schema":{"type":"object","additionalProperties":false,"required":["question","evidence","memory","style_catalog","binding"]},"output_schema":{"type":"object","required":["answer_mode","style_id","claim_order","claims","relations","render_contract"]},"required_grants":[],"evidence_classes":["prose.claim_closure"],"timeout_ms":30000}],"contributions":[{"slot":"workspace.main","label":"Prose","entry":"ui/index.html"}],"compatibility":{"host_api":">=1.0 <2.0","release_gate":"license+provenance+claim-closure+grammar+originality+human-preference"}}
