{"schema_version":"polar.plugin/v1","id":"dev.luxeron.engine.watch-os","version":"0.1.0","name":"Polar Pyro Apple Watch Target","kind":"engine","publisher":"LUXERON","license":"MIT","source":{"repository":"https://github.com/LUXERON/POLAR-PYRO-WATCH-OS-PLUGIN","commit":"fa83be943dde3f3ef4ebf3b64ee7e3d78dbde7bc","upstream":"FINAL_APPLE_WATCH_EXPERIENCE_ENGINE_ARCHITECTURE.md"},"transport":{"kind":"native","command":["polar-watch-plan"]},"capabilities":[{"id":"watch.compile_build_plan","effect":"observe","input_schema":{"type":"object","additionalProperties":false,"required":["application","binding","operations","surface_catalog","apple_catalog","target_profile"]},"output_schema":{"type":"object","required":["application_id","target","modules","operations","euclid_obligations","release_gates"]},"required_grants":[],"evidence_classes":["watch.closed_build_plan"],"timeout_ms":30000}],"contributions":[{"slot":"target.compiler","label":"Apple Watch","entry":"watch.compile_build_plan"}],"compatibility":{"host_api":">=1.0 <2.0","ios_parent":"dev.luxeron.engine.ios","release_gate":"euclid+swift+xcode+watch-surfaces+energy+mutation+physical-device+signing+testflight"}}
